{
  "version": "1.0.0",
  "orderId": "ORDER-2025-001",
  "timestamp": "2025-10-24T09:00:00Z",
  "components": [
    {
      "componentId": "door-panel-001",
      "fusionModelPath": "F360MT - PartitionDoor(1).f3d",
      "parameters": {
        "component_height": "84 in",
        "component_width": "30 in",
        "component_floor_clearance": "2 in",
        "door_hinging_right": "0",
        "door_swinging_out": "0",
        "door_wall_post_hinging": "1",
        "door_wall_keep_latching": "1"
      },
      "setupNames": [],
      "postProcessorConfig": {
        "postProcessorName": "fanuc",
        "outputFileName": "door-panel-001"
      },
      "metadata": {
        "customerName": "Test Customer",
        "notes": "Phase 2 test - parameter application"
      }
    }
  ],
  "outputConfig": {
    "baseDirectory": "C:\\Manufacturing\\Output",
    "includeTimestamp": true
  }
}
